{
  "$schema": "boundary-registry.schema.json",
  "schemaVersion": "1.0.0",
  "registryVersion": "1.0.0",
  "publishedAt": "2026-07-21",
  "compatibility": {
    "engine": "IndiaMapEngine",
    "minimumVersion": "1.0.0"
  },
  "sources": {
    "datta07-indian-shapefiles": {
      "name": "INDIAN-SHAPEFILES",
      "publisher": "datta07",
      "url": "https://github.com/datta07/INDIAN-SHAPEFILES",
      "revision": "2c028f5c30fb4191ca1639ff136b152cecdbb69f",
      "license": {
        "name": "MIT License",
        "spdx": "MIT",
        "url": "https://opensource.org/license/mit"
      },
      "attribution": "datta07/INDIAN-SHAPEFILES",
      "redistribution": "ready"
    },
    "india-census-2011-admin-boundaries": {
      "name": "India Census 2011 administrative boundaries",
      "publisher": "DataMeet and original government sources",
      "url": "https://github.com/ramSeraph/indian_admin_boundaries/releases/tag/census-2011",
      "revision": "census-2011 release",
      "license": {
        "name": "CC0 1.0",
        "spdx": "CC0-1.0",
        "url": "https://creativecommons.org/publicdomain/zero/1.0/"
      },
      "attribution": "DataMeet and the original government source where possible",
      "redistribution": "ready"
    }
  },
  "layers": [
    {
      "id": "IN-REGIONS",
      "parentId": null,
      "level": "regions",
      "label": "India states and union territories",
      "regionSlug": "india",
      "path": "assets/maps/india-states.svg",
      "format": "svg",
      "status": "ready",
      "featureCount": 36,
      "declaredFeatureCount": 36,
      "identifiers": {
        "layer": "data-layer-id",
        "feature": "data-region-id",
        "slug": "data-slug"
      },
      "sourceId": "datta07-indian-shapefiles",
      "vintages": [
        "source-vintage"
      ],
      "engine": {
        "api": "IndiaMapEngine",
        "minimumVersion": "1.0.0",
        "featureSelector": ".map-region",
        "featureKey": "slug"
      },
      "verification": {
        "status": "verified",
        "checkedAt": "2026-07-21",
        "checks": {
          "declaredCountMatches": true,
          "featureIdsPresent": true,
          "featureIdsUnique": true,
          "featureSlugsPresent": true,
          "featureSlugsUnique": true
        },
        "warnings": [],
        "errors": []
      }
    },
    {
      "id": "IN-REGION-35-DISTRICTS",
      "parentId": "IN-REGION-35",
      "level": "districts",
      "label": "Andaman and Nicobar Islands districts",
      "regionSlug": "andaman-and-nicobar-islands",
      "path": "assets/maps/states/andaman-and-nicobar-islands.svg",
      "format": "svg",
      "status": "ready",
      "featureCount": 3,
      "declaredFeatureCount": 3,
      "identifiers": {
        "layer": "data-layer-id",
        "feature": "data-feature-id",
        "slug": "data-slug"
      },
      "sourceId": "datta07-indian-shapefiles",
      "vintages": [
        "2011_c"
      ],
      "engine": {
        "api": "IndiaMapEngine",
        "minimumVersion": "1.0.0",
        "featureSelector": ".district-region",
        "featureKey": "slug"
      },
      "verification": {
        "status": "verified",
        "checkedAt": "2026-07-21",
        "checks": {
          "declaredCountMatches": true,
          "featureIdsPresent": true,
          "featureIdsUnique": true,
          "featureSlugsPresent": true,
          "featureSlugsUnique": true
        },
        "warnings": [],
        "errors": []
      }
    },
    {
      "id": "IN-REGION-37-DISTRICTS",
      "parentId": "IN-REGION-37",
      "level": "districts",
      "label": "Andhra Pradesh districts",
      "regionSlug": "andhra-pradesh",
      "path": "assets/maps/states/andhra-pradesh.svg",
      "format": "svg",
      "status": "ready",
      "featureCount": 26,
      "declaredFeatureCount": 26,
      "identifiers": {
        "layer": "data-layer-id",
        "feature": "data-feature-id",
        "slug": "data-slug"
      },
      "sourceId": "datta07-indian-shapefiles",
      "vintages": [],
      "engine": {
        "api": "IndiaMapEngine",
        "minimumVersion": "1.0.0",
        "featureSelector": ".district-region",
        "featureKey": "slug"
      },
      "verification": {
        "status": "compatible",
        "checkedAt": "2026-07-21",
        "checks": {
          "declaredCountMatches": true,
          "featureIdsPresent": true,
          "featureIdsUnique": true,
          "featureSlugsPresent": true,
          "featureSlugsUnique": true
        },
        "warnings": [
          "26 of 26 features do not declare data-lgd-code",
          "26 of 26 features do not declare data-boundary-year"
        ],
        "errors": []
      }
    },
    {
      "id": "IN-REGION-12-DISTRICTS",
      "parentId": "IN-REGION-12",
      "level": "districts",
      "label": "Arunachal Pradesh districts",
      "regionSlug": "arunachal-pradesh",
      "path": "assets/maps/states/arunachal-pradesh.svg",
      "format": "svg",
      "status": "ready",
      "featureCount": 25,
      "declaredFeatureCount": 25,
      "identifiers": {
        "layer": "data-layer-id",
        "feature": "data-feature-id",
        "slug": "data-slug"
      },
      "sourceId": "datta07-indian-shapefiles",
      "vintages": [
        "2011_c",
        "2012_c",
        "2014_c",
        "2015_c",
        "2018"
      ],
      "engine": {
        "api": "IndiaMapEngine",
        "minimumVersion": "1.0.0",
        "featureSelector": ".district-region",
        "featureKey": "slug"
      },
      "verification": {
        "status": "verified",
        "checkedAt": "2026-07-21",
        "checks": {
          "declaredCountMatches": true,
          "featureIdsPresent": true,
          "featureIdsUnique": true,
          "featureSlugsPresent": true,
          "featureSlugsUnique": true
        },
        "warnings": [],
        "errors": []
      }
    },
    {
      "id": "IN-REGION-18-DISTRICTS",
      "parentId": "IN-REGION-18",
      "level": "districts",
      "label": "Assam districts",
      "regionSlug": "assam",
      "path": "assets/maps/states/assam.svg",
      "format": "svg",
      "status": "ready",
      "featureCount": 33,
      "declaredFeatureCount": 33,
      "identifiers": {
        "layer": "data-layer-id",
        "feature": "data-feature-id",
        "slug": "data-slug"
      },
      "sourceId": "datta07-indian-shapefiles",
      "vintages": [
        "2011_c",
        "2015_c",
        "2016_c"
      ],
      "engine": {
        "api": "IndiaMapEngine",
        "minimumVersion": "1.0.0",
        "featureSelector": ".district-region",
        "featureKey": "slug"
      },
      "verification": {
        "status": "verified",
        "checkedAt": "2026-07-21",
        "checks": {
          "declaredCountMatches": true,
          "featureIdsPresent": true,
          "featureIdsUnique": true,
          "featureSlugsPresent": true,
          "featureSlugsUnique": true
        },
        "warnings": [],
        "errors": []
      }
    },
    {
      "id": "IN-REGION-10-DISTRICTS",
      "parentId": "IN-REGION-10",
      "level": "districts",
      "label": "Bihar districts",
      "regionSlug": "bihar",
      "path": "assets/maps/states/bihar.svg",
      "format": "svg",
      "status": "ready",
      "featureCount": 38,
      "declaredFeatureCount": 38,
      "identifiers": {
        "layer": "data-layer-id",
        "feature": "data-feature-id",
        "slug": "data-slug"
      },
      "sourceId": "datta07-indian-shapefiles",
      "vintages": [
        "2011_c"
      ],
      "engine": {
        "api": "IndiaMapEngine",
        "minimumVersion": "1.0.0",
        "featureSelector": ".district-region",
        "featureKey": "slug"
      },
      "verification": {
        "status": "verified",
        "checkedAt": "2026-07-21",
        "checks": {
          "declaredCountMatches": true,
          "featureIdsPresent": true,
          "featureIdsUnique": true,
          "featureSlugsPresent": true,
          "featureSlugsUnique": true
        },
        "warnings": [],
        "errors": []
      }
    },
    {
      "id": "IN-REGION-04-DISTRICTS",
      "parentId": "IN-REGION-04",
      "level": "districts",
      "label": "Chandigarh districts",
      "regionSlug": "chandigarh",
      "path": "assets/maps/states/chandigarh.svg",
      "format": "svg",
      "status": "ready",
      "featureCount": 1,
      "declaredFeatureCount": 1,
      "identifiers": {
        "layer": "data-layer-id",
        "feature": "data-feature-id",
        "slug": "data-slug"
      },
      "sourceId": "datta07-indian-shapefiles",
      "vintages": [
        "2011_c"
      ],
      "engine": {
        "api": "IndiaMapEngine",
        "minimumVersion": "1.0.0",
        "featureSelector": ".district-region",
        "featureKey": "slug"
      },
      "verification": {
        "status": "verified",
        "checkedAt": "2026-07-21",
        "checks": {
          "declaredCountMatches": true,
          "featureIdsPresent": true,
          "featureIdsUnique": true,
          "featureSlugsPresent": true,
          "featureSlugsUnique": true
        },
        "warnings": [],
        "errors": []
      }
    },
    {
      "id": "IN-REGION-22-DISTRICTS",
      "parentId": "IN-REGION-22",
      "level": "districts",
      "label": "Chhattisgarh districts",
      "regionSlug": "chhattisgarh",
      "path": "assets/maps/states/chhattisgarh.svg",
      "format": "svg",
      "status": "ready",
      "featureCount": 28,
      "declaredFeatureCount": 28,
      "identifiers": {
        "layer": "data-layer-id",
        "feature": "data-feature-id",
        "slug": "data-slug"
      },
      "sourceId": "datta07-indian-shapefiles",
      "vintages": [
        "2011_c",
        "2020",
        "update2014"
      ],
      "engine": {
        "api": "IndiaMapEngine",
        "minimumVersion": "1.0.0",
        "featureSelector": ".district-region",